{
  "id": "card-ex-inference-progress",
  "meta": {
    "title": "Inference Progress Demo",
    "tags": [
      "inference",
      "async"
    ],
    "desc": "Demonstrates async inference task-progress when evidence is insufficient"
  },
  "requires": [
    "orders"
  ],
  "compute": [
    {
      "bindTo": "orderCount",
      "expr": "$count(requires.orders)"
    },
    {
      "bindTo": "deploymentStatus",
      "expr": "'pending'"
    }
  ],
  "view": {
    "elements": [
      {
        "kind": "metric",
        "label": "Orders Seen",
        "data": {
          "bind": "computed_values.orderCount"
        }
      },
      {
        "kind": "badge",
        "label": "Deployment",
        "data": {
          "bind": "computed_values.deploymentStatus",
          "colorMap": {
            "done": "success",
            "pending": "warning"
          }
        }
      },
      {
        "kind": "text",
        "label": "Inference Reason",
        "style": "muted-italic",
        "data": {
          "bind": "card_data.llm_task_completion_inference.reason",
          "hideIfEmpty": true
        }
      }
    ],
    "layout": {
      "board": {
        "col": 4,
        "order": 24
      },
      "canvas": {
        "x": 1140,
        "y": 1100,
        "w": 260,
        "h": 180
      }
    }
  },
  "card_data": {}
}
