{
  "id": "price-fetch",
  "meta": { "title": "Fetch Market Prices" },
  "requires": ["holdings"],
  "provides": [{ "bindTo": "prices", "ref": "fetched_sources.prices" }],
  "card_data": {},
  "source_defs": [
    { "cli": "node ../fetch-prices.js --tmp-file-name tmp_file1", "bindTo": "prices", "outputFile": "prices.json" }
  ],
  "view": {
    "elements": [
      { "kind": "table", "label": "Market Prices", "data": { "bind": "fetched_sources.prices" } }
    ]
  }
}
