{
  "id": "card-portfolio-value",
  "meta": {
    "title": "Portfolio Value",
    "tags": [
      "portfolio",
      "value"
    ],
    "desc": "Computes total portfolio value, gainers/losers summary, and per-position P&L from holdings and live market quotes."
  },
  "requires": [
    "holdings",
    "quotes"
  ],
  "provides": [
    {
      "bindTo": "positions",
      "ref": "computed_values.positions"
    }
  ],
  "compute": [
    {
      "bindTo": "positions",
      "expr": "($hMap := $merge(requires.holdings.{ticker: $}); $map(requires.quotes.quoteResponse.result, function($q) { ($h := $lookup($hMap, $q.symbol); $qty := $h.quantity; $cb := $h.cost_basis; $val := $round($q.regularMarketPrice * $qty, 2); $cost := $round($cb * $qty, 2); $chg := $round($q.regularMarketChange * $qty, 2); {\"ticker\": $q.symbol, \"quantity\": $qty, \"cost_basis\": $cb, \"price\": $round($q.regularMarketPrice, 2), \"value\": $val, \"gain_$\": $round($val - $cost, 2), \"gain_%\": $round(($val - $cost) / $cost * 100, 2), \"chg_$\": $chg, \"chg_pct\": $round($q.regularMarketChangePercent, 2)}) }))"
    },
    {
      "bindTo": "totalValue",
      "expr": "$round($sum(computed_values.positions.value), 2)"
    },
    {
      "bindTo": "gainers",
      "expr": "$count($filter(computed_values.positions, function($p){ $p.chg_pct > 0 }))"
    },
    {
      "bindTo": "losers",
      "expr": "$count($filter(computed_values.positions, function($p){ $p.chg_pct < 0 }))"
    },
    {
      "bindTo": "gainersLosers",
      "expr": "computed_values.gainers & ' up \u00b7 ' & computed_values.losers & ' down'"
    }
  ],
  "view": {
    "elements": [
      {
        "kind": "metric",
        "label": "Portfolio Value ($)",
        "data": {
          "bind": "computed_values.totalValue"
        }
      },
      {
        "kind": "text",
        "data": {
          "bind": "computed_values.gainersLosers"
        }
      },
      {
        "kind": "table",
        "label": "Positions",
        "data": {
          "bind": "computed_values.positions",
          "columns": [
            "ticker",
            "value",
            "gain_$",
            "gain_%"
          ],
          "sortable": true
        }
      }
    ],
    "layout": {
      "board": {
        "col": 4,
        "order": 3
      },
      "canvas": {
        "x": 840,
        "y": 50,
        "w": 420,
        "h": 380
      }
    },
    "features": {
      "chat": true
    }
  },
  "card_data": {}
}