{
  "id": "card-market-prices",
  "meta": {
    "title": "Market Prices",
    "tags": [
      "prices",
      "market"
    ],
    "desc": "Fetches live prices for portfolio tickers. Publishes enriched quote data for downstream portfolio value calculations."
  },
  "requires": [
    "holdings"
  ],
  "source_defs": [
    {
      "bindTo": "quotes",
      "outputFile": "market-prices-quotes.json",
      "projections": {
        "quote_urls": "requires.holdings.ticker.('https://query1.finance.yahoo.com/v8/finance/chart/' & $ & '?interval=1d&range=1d')"
      },
      "urls": {
        "url": "{{url}}",
        "projectionList": "quote_urls",
        "headers": {
          "User-Agent": "Mozilla/5.0 (compatible; portfolio-tracker-demo/1.0)"
        },
        "cacheTimeout": 3600
      }
    }
  ],
  "compute": [
    {
      "bindTo": "normalizedQuotes",
      "expr": "($raw := fetched_sources.quotes; $rows := $type($raw) = 'array' ? $raw : (($exists($raw.resultValue) and $type($raw.resultValue) = 'array') ? $raw.resultValue : [$raw]); $normalized := $filter($map($rows, function($row) { ($level1 := $exists($row.resultValue) ? $row.resultValue : $row; $level2 := $exists($level1.resultValue) ? $level1.resultValue : $level1; $meta := $level2.chart.result[0].meta; $exists($meta.symbol) ? { \"symbol\": $meta.symbol, \"shortName\": ($exists($meta.longName) ? $meta.longName : $meta.shortName), \"regularMarketPrice\": $meta.regularMarketPrice, \"regularMarketChange\": ($exists($meta.regularMarketChange) ? $meta.regularMarketChange : (($exists($meta.chartPreviousClose) and $exists($meta.regularMarketPrice)) ? ($meta.regularMarketPrice - $meta.chartPreviousClose) : null)), \"regularMarketChangePercent\": ($exists($meta.regularMarketChangePercent) ? $meta.regularMarketChangePercent : (($exists($meta.chartPreviousClose) and $meta.chartPreviousClose != 0 and $exists($meta.regularMarketPrice)) ? (($meta.regularMarketPrice - $meta.chartPreviousClose) / $meta.chartPreviousClose * 100) : null)) } : undefined) }), function($q) { $exists($q.symbol) }); { \"quoteResponse\": { \"result\": $normalized, \"error\": null } })"
    },
    {
      "bindTo": "prices",
      "expr": "$map(computed_values.normalizedQuotes.quoteResponse.result, function($q) { {\"ticker\": $q.symbol, \"name\": $q.shortName, \"price\": ($exists($q.regularMarketPrice) ? $round($q.regularMarketPrice, 2) : null), \"change\": ($exists($q.regularMarketChange) ? $round($q.regularMarketChange, 2) : null), \"chg_pct\": ($exists($q.regularMarketChangePercent) ? $round($q.regularMarketChangePercent, 2) : null)} })"
    }
  ],
  "provides": [
    {
      "bindTo": "quotes",
      "ref": "computed_values.normalizedQuotes"
    }
  ],
  "view": {
    "elements": [
      {
        "kind": "table",
        "label": "Prices",
        "data": {
          "bind": "computed_values.prices",
          "columns": [
            "ticker",
            "name",
            "price",
            "change",
            "chg_pct"
          ],
          "sortable": true
        }
      }
    ],
    "layout": {
      "board": {
        "col": 4,
        "order": 2
      },
      "canvas": {
        "x": 400,
        "y": 50,
        "w": 400,
        "h": 340
      }
    },
    "features": {
      "refresh": true
    }
  },
  "card_data": {}
}