{
  "id": "card-ex-actions",
  "meta": {
    "title": "Action Router",
    "tags": ["actions", "interactive"],
    "desc": "Simple button actions routed through board-level handler"
  },
  "view": {
    "elements": [
      {
        "kind": "actions",
        "label": "Workflow Actions",
        "data": {
          "buttons": [
            { "id": "approve", "label": "Approve", "style": "success" },
            { "id": "needs-review", "label": "Needs Review", "style": "warning" },
            { "id": "escalate", "label": "Escalate", "style": "danger" }
          ]
        }
      },
      {
        "kind": "text",
        "label": "Last Action",
        "data": { "bind": "card_data.lastActionText", "style": "muted" }
      }
    ],
    "layout": { "board": { "col": 4, "order": 14 }, "canvas": { "x": 980, "y": 320, "w": 260, "h": 180 } }
  },
  "card_data": {
    "lastActionText": "No action yet"
  }
}
