{
  "id": "card-ex-metric",
  "meta": {
    "title": "Total Revenue",
    "tags": [],
    "desc": "Single KPI — sum of all order amounts via JSONata $sum"
  },
  "requires": ["orders"],
  "compute": [
    { "bindTo": "totalRevenue", "expr": "$round($sum(requires.orders.amount), 2)" }
  ],
  "view": {
    "elements": [
      { "kind": "metric", "label": "Revenue", "data": { "bind": "computed_values.totalRevenue" } }
    ],
    "layout": { "board": { "col": 3, "order": 4 }, "canvas": { "x": 320, "y": 320, "w": 180, "h": 120 } }
  },
  "card_data": {}
}
