{
  "id": "portfolio-form",
  "meta": {
    "title": "Portfolio Holdings Form"
  },
  "provides": [
    {
      "bindTo": "holdings",
      "ref": "card_data.holdings"
    }
  ],
  "card_data": {
    "holdings": [
      {
        "symbol": "AAPL",
        "qty": 50
      },
      {
        "symbol": "MSFT",
        "qty": 30
      },
      {
        "symbol": "GOOG",
        "qty": 100
      }
    ]
  },
  "view": {
    "elements": [
      {
        "kind": "table",
        "label": "Holdings",
        "data": {
          "bind": "card_data.holdings",
          "columns": [
            "symbol",
            "qty"
          ]
        }
      }
    ]
  }
}
